[
  {
    "equipmentId": "short-sword",
    "categoryId": "attack",
    "level": 1,
    "number": 1,
    "price": 250,
    "isActive": false,
    "name": "Short Sword",
    "asset": "equipments/A101_SS_Short-Sword.webp",
    "stats": {
      "attackDamage": 20
    }
  },
  {
    "equipmentId": "dagger",
    "categoryId": "attack",
    "level": 1,
    "number": 2,
    "price": 290,
    "isActive": false,
    "name": "Dagger",
    "asset": "equipments/A102_DG_Dagger.webp",
    "stats": {
      "attackSpeed": 10
    }
  },
  {
    "equipmentId": "gloves",
    "categoryId": "attack",
    "level": 1,
    "number": 3,
    "price": 300,
    "isActive": false,
    "name": "Gloves",
    "asset": "equipments/A103_GL_Gloves.webp",
    "stats": {
      "criticalRate": 8
    }
  },
  {
    "equipmentId": "bloodied-club",
    "categoryId": "attack",
    "level": 1,
    "number": 4,
    "price": 410,
    "isActive": false,
    "name": "Bloodied Club",
    "asset": "equipments/A104_BC_Bloodied-Club.webp",
    "stats": {
      "attackDamage": 10,
      "physicalLifesteal": 8
    }
  },
  {
    "equipmentId": "chain-hammer",
    "categoryId": "attack",
    "level": 1,
    "number": 5,
    "price": 450,
    "isActive": false,
    "name": "Chain Hammer",
    "asset": "equipments/A105_CH_Chain-Hammer.webp",
    "stats": {
      "attackDamage": 40
    }
  },
  {
    "equipmentId": "cleaving-claymore",
    "categoryId": "attack",
    "level": 2,
    "number": 1,
    "price": 910,
    "recipe": [
      "short-sword"
    ],
    "isActive": false,
    "name": "Cleaving Claymore",
    "asset": "equipments/A201_CC_Cleaving-Claymore.webp",
    "stats": {
      "attackDamage": 80
    }
  },
  {
    "equipmentId": "arcane-hammer",
    "categoryId": "attack",
    "level": 2,
    "number": 2,
    "price": 740,
    "recipe": [
      "short-sword",
      "dagger"
    ],
    "isActive": false,
    "name": "Arcane Hammer",
    "asset": "equipments/A202_AH_Arcane-Hammer.webp",
    "stats": {
      "attackDamage": 25,
      "attackSpeed": 15
    },
    "passives": [
      {
        "passiveId": "arcane-hammer-p1",
        "index": 1,
        "name": "Speed Up",
        "description": "Normal attacks increase Movement Speed by 10%.",
        "uniqueGroup": "speed-up"
      }
    ]
  },
  {
    "equipmentId": "tempest-blades",
    "categoryId": "attack",
    "level": 2,
    "number": 3,
    "price": 780,
    "recipe": [
      "dagger",
      "dagger"
    ],
    "isActive": false,
    "name": "Tempest Blades",
    "asset": "equipments/A203_TB_Tempest-Blades.webp",
    "stats": {
      "attackSpeed": 25,
      "movementSpeed": 5
    }
  },
  {
    "equipmentId": "astral-spear",
    "categoryId": "attack",
    "level": 2,
    "number": 4,
    "price": 830,
    "recipe": [
      "short-sword",
      "short-sword"
    ],
    "isActive": false,
    "name": "Astral Spear",
    "asset": "equipments/A204_AS_Astral-Spear.webp",
    "stats": {
      "attackDamage": 50
    },
    "passives": [
      {
        "passiveId": "astral-spear-p1",
        "index": 1,
        "name": "Armor Reduction",
        "description": "+60 Armor Pierce",
        "uniqueGroup": "physical-pierce"
      }
    ]
  },
  {
    "equipmentId": "shuriken",
    "categoryId": "attack",
    "level": 2,
    "number": 5,
    "price": 750,
    "recipe": [
      "dagger",
      "dagger"
    ],
    "isActive": false,
    "name": "Shuriken",
    "asset": "equipments/A205_SRK_Shuriken.webp",
    "stats": {
      "attackSpeed": 20
    },
    "passives": [
      {
        "passiveId": "shuriken-p1",
        "index": 1,
        "name": "Vital Point",
        "description": "Normal attacks deal 21–35 (melee) or 42–70 (ranged) additional physical damage.",
        "cooldown": 0.3
      }
    ]
  },
  {
    "equipmentId": "bloodthirsty-blade",
    "categoryId": "attack",
    "level": 2,
    "number": 6,
    "price": 830,
    "recipe": [
      "bloodied-club",
      "short-sword"
    ],
    "isActive": false,
    "name": "Bloodthirsty Blade",
    "asset": "equipments/A206_BB_BloodthirstyBlade.webp",
    "stats": {
      "attackDamage": 30,
      "physicalLifesteal": 10
    },
    "passives": [
      {
        "passiveId": "bloodthirsty-blade-p1",
        "index": 1,
        "name": "Blood Feast",
        "description": "When HP drops below 30%, restores 400–610 HP over 5s.",
        "cooldown": 20,
        "uniqueGroup": "blood-feast"
      }
    ]
  },
  {
    "equipmentId": "chaos-bow",
    "categoryId": "attack",
    "level": 2,
    "number": 7,
    "price": 1100,
    "recipe": [
      "chain-hammer",
      "dagger"
    ],
    "isActive": false,
    "name": "Chaos Bow",
    "asset": "equipments/A207_CB_Chaos-Bow.webp",
    "stats": {
      "attackDamage": 40,
      "attackSpeed": 10
    },
    "passives": [
      {
        "passiveId": "chaos-bow-p1",
        "index": 1,
        "name": "Stab",
        "description": "Increases Armor Penetration by 10% (doubled for ranged heroes).",
        "uniqueGroup": "stab"
      }
    ]
  },
  {
    "equipmentId": "uriels-brand",
    "categoryId": "attack",
    "level": 2,
    "number": 8,
    "price": 2000,
    "recipe": [
      "arcane-hammer",
      "short-sword",
      "gladiators-gauntlets"
    ],
    "isActive": false,
    "name": "Uriel's Brand",
    "asset": "equipments/A208_UB_Uriels-Brand.webp",
    "stats": {
      "attackDamage": 80,
      "attackSpeed": 25,
      "magicArmor": 200
    },
    "passives": [
      {
        "passiveId": "uriels-brand-p1",
        "index": 1,
        "name": "Magic Guardian",
        "description": "When HP falls below 40%, grants a shield that absorbs 600–2000 magic damage, and increases Resistance by 25% and Movement Speed by 30% for 5s.",
        "cooldown": 75
      },
      {
        "passiveId": "uriels-brand-p2",
        "index": 2,
        "name": "Speed Up",
        "description": "Normal attacks increase Movement Speed by 10%.",
        "uniqueGroup": "speed-up"
      }
    ]
  },
  {
    "equipmentId": "death-curse",
    "categoryId": "attack",
    "level": 2,
    "number": 9,
    "price": 1900,
    "recipe": [
      "cleaving-claymore",
      "magic-ring",
      "necklace-of-vitality"
    ],
    "isActive": false,
    "name": "Death Curse",
    "asset": "equipments/A209_DC_Death-Curse.webp",
    "stats": {
      "attackDamage": 80,
      "maxHp": 800,
      "cooldownReduction": 10
    },
    "passives": [
      {
        "passiveId": "death-curse-p1",
        "index": 1,
        "name": "Soul Prison",
        "description": "Damage dealt by normal attacks and skills reduces the target's healing by 40% for 3s.",
        "uniqueGroup": "anti-heal"
      }
    ]
  },
  {
    "equipmentId": "death-sickle",
    "categoryId": "attack",
    "level": 2,
    "number": 10,
    "price": 2000,
    "recipe": [
      "chain-hammer",
      "dagger",
      "ring-of-vitality"
    ],
    "isActive": false,
    "name": "Death Sickle",
    "asset": "equipments/A210_DS_Death-Sickle.webp",
    "stats": {
      "attackDamage": 75,
      "attackSpeed": 15,
      "maxHp": 500
    },
    "passives": [
      {
        "passiveId": "death-sickle-p1",
        "index": 1,
        "name": "Insatiable",
        "description": "Grants invincibility and temporary damage immunity, and increases Attack Speed and Movement Speed by 25% for 0.75s. After holding the item for 4 minutes, the effect lasts for 1.5s.",
        "cooldown": 120
      }
    ]
  },
  {
    "equipmentId": "bow-of-slaughter",
    "categoryId": "attack",
    "level": 2,
    "number": 11,
    "price": 2250,
    "recipe": [
      "bloodied-club",
      "gloves",
      "cleaving-claymore"
    ],
    "isActive": true,
    "name": "Bow of Slaughter",
    "asset": "equipments/A211_BoS_Bow-of-Slaughter.webp",
    "stats": {
      "attackDamage": 90,
      "criticalRate": 10,
      "physicalLifesteal": 10
    },
    "passives": [
      {
        "passiveId": "bow-of-slaughter-p1",
        "index": 1,
        "name": "Bloodthirst",
        "description": "Active: Increases Life Steal by 60% for 3s. Only usable by ranged heroes.",
        "cooldown": 60
      }
    ]
  },
  {
    "equipmentId": "the-diminisher",
    "categoryId": "attack",
    "level": 2,
    "number": 12,
    "price": 2120,
    "recipe": [
      "cleaving-claymore",
      "magic-ring",
      "ring-of-vitality"
    ],
    "isActive": true,
    "name": "The Diminisher",
    "asset": "equipments/A212_TD_The-Diminisher.webp",
    "stats": {
      "attackDamage": 100,
      "maxHp": 500,
      "cooldownReduction": 10
    },
    "passives": [
      {
        "passiveId": "the-diminisher-p1",
        "index": 1,
        "name": "Sturdy",
        "description": "Active: Grants 40% damage reduction for 2s. Can be used under control effects.",
        "cooldown": 90
      },
      {
        "passiveId": "the-diminisher-p2",
        "index": 2,
        "name": "Cripple",
        "description": "Skills cause the first enemy hero struck to slow by 30% and reduce their damage dealt by 20% for 3s.",
        "cooldown": 8
      }
    ]
  },
  {
    "equipmentId": "eclipsing-bow",
    "categoryId": "attack",
    "level": 2,
    "number": 13,
    "price": 2000,
    "recipe": [
      "shuriken",
      "gloves",
      "dagger"
    ],
    "isActive": true,
    "name": "Eclipsing Bow",
    "asset": "equipments/A213_EB_Eclipsing-Bow.webp",
    "stats": {
      "attackSpeed": 30,
      "criticalRate": 10,
      "movementSpeed": 5
    },
    "passives": [
      {
        "passiveId": "eclipsing-bow-p1",
        "index": 1,
        "name": "Reach",
        "description": "Active: Increases normal attack range by 150 and Movement Speed by 20% for 5s. Increased range only applicable to ranged heroes.",
        "cooldown": 60
      },
      {
        "passiveId": "eclipsing-bow-p2",
        "index": 2,
        "name": "Wound",
        "description": "Normal attacks deal 50 additional physical damage (doubled for ranged heroes).",